{
  "_FICTIONAL": "ALL DATA IN THIS FIXTURE IS FICTIONAL. Not a real project, company, or person.",
  "brief_date": "2026-10-06",
  "compare_to": "2026-10-05",
  "scoring": {
    "match_rule": "A brief item matches an expected finding if it cites >= min_citations_matched of required_citations AND its numeric key_facts fall within tolerance (exact match where no tolerance given).",
    "recall_denominator": "findings with must_surface=true",
    "rank_rule": "rank_expectation 'top N' = the matched item must appear within the first N ranked items. reference_rank = position under the DAILY_BRIEF_SPEC.md section 5 reference scoring (informational; used for the rank-correlation metric in EVALS.md, not pass/fail)",
    "merge_rule": "One brief item may satisfy several expected findings (e.g. F5+F6 as a distress composite; F9 is standalone and must not merge) if it meets each one's citation and key_fact criteria"
  },
  "required_freshness_disclosures": [
    {
      "source": "schedule",
      "must_state": "XER data date 2026-09-28, uploaded 2026-10-02",
      "freshness_band": "aging (8 days since data date)",
      "effect": "Schedule-derived float/forecast claims capped at 'Likely' unless corroborated by fresher records"
    },
    {
      "source": "email",
      "must_state": "Only lindenyard@larkspurdev.example is covered"
    },
    {
      "source": "procore",
      "must_state": "Nightly DMSA sync time"
    }
  ],
  "findings": [
    {
      "id": "F1",
      "title": "Transfer steel critical-path threat: RFI 42 overdue 7d + steel shop drawings rev 1 overdue 5d with SEOR + fabricator needs release by Fri 10/9 or shop slot slips 2 weeks + A1230 total float eroded 8 -> 3 wd",
      "section": "schedule_risks",
      "must_surface": true,
      "reference_rank": 2,
      "rank_expectation": "top 2",
      "min_severity": "critical",
      "required_citations": [
        "procore:rfi:9042",
        "procore:submittal:6103",
        "msgraph_outlook:message:msg_E104",
        "p6:activity:A1230",
        "p6:activity:A1225",
        "procore:meeting_item:991402"
      ],
      "min_citations_matched": 3,
      "key_facts": {
        "decision_deadline": "2026-10-09",
        "rfi_days_overdue": 7,
        "submittal_days_overdue": 5,
        "tf_wd_u1_u2": [
          8,
          3
        ],
        "delivery_slip_if_missed_cd": 14,
        "delivery_slip_if_missed_wd": 10,
        "tco_impact_wd_if_missed": {
          "value": 7,
          "tolerance": 3
        },
        "usd_exposure_if_missed": {
          "value": 192000,
          "tolerance_pct": 35,
          "method": "TCO 2027-08-27 -> 2027-09-08 = 12 calendar days x $16,000/cd"
        }
      },
      "expected_owner_roles": [
        "Structural EOR (Raj Mehta, Tandem)",
        "GC Sr PM (Priya Nair)"
      ],
      "expected_action": "Get RFI 42 answered and rev 1 returned by Thu 10/8 so Bayline can release by Fri 10/9; ask Bayline about partial release of non-embed members",
      "confidence_expectation": "Confirmed for dates/overdue facts; Likely for TCO impact (schedule source is aging)",
      "new_or_worse": "WORSE"
    },
    {
      "id": "F2",
      "title": "Window submittal 08 53 13-001: third revise-and-resubmit; rev 3 must be submitted by 10/7 to hold ROS 2027-02-15 (112-day lead); must incorporate A-501 Rev 4 issued today",
      "section": "overdue_submittals",
      "must_surface": true,
      "reference_rank": 5,
      "rank_expectation": "top 7",
      "min_severity": "high",
      "required_citations": [
        "procore:submittal:6202",
        "procore:submittal:6203",
        "msgraph_outlook:message:msg_E107",
        "procore:drawing_revision:7751",
        "p6:activity:A2400"
      ],
      "min_citations_matched": 2,
      "key_facts": {
        "rr_cycles": 3,
        "latest_return_date": "2026-10-21",
        "rev3_submit_by": "2026-10-07",
        "margin_days": 0,
        "lead_time_days": 112,
        "a2400_tf_wd": 12
      },
      "expected_owner_roles": [
        "GC PE (Kevin Osei)",
        "ClearSpan PM (Eli Novak)",
        "Architect (Hannah Cole)"
      ],
      "expected_action": "Take the architect's pre-review call; resubmit with stamped calcs, NFRC certs and the A-501 Rev 4 sill detail by 10/7; ask for a 7-day review",
      "confidence_expectation": "Confirmed",
      "new_or_worse": "WORSE (R&R returned today)"
    },
    {
      "id": "F3",
      "title": "Switchgear PO-0117 still Draft 18 days after submittal approval; quote expires Fri 10/9 (+4%, lead time 30 -> 32 wk); A3050 float 15 -> 10 wd and eroding ~1 wd per workday",
      "section": "procurement_issues",
      "must_surface": true,
      "reference_rank": 1,
      "rank_expectation": "top 2",
      "min_severity": "high",
      "required_citations": [
        "procore:commitment:3401",
        "procore:submittal:6301",
        "msgraph_outlook:message:msg_E101",
        "p6:activity:A3050",
        "procore:meeting_item:991403"
      ],
      "min_citations_matched": 3,
      "key_facts": {
        "po_status": "Draft",
        "quote_expiry": "2026-10-09",
        "escalation_usd": {
          "value": 19460,
          "tolerance_pct": 5
        },
        "tf_wd_u1_u2": [
          15,
          10
        ],
        "est_tf_wd_as_of_2026_10_06": {
          "value": 4,
          "tolerance": 1
        },
        "lead_time_after_expiry_weeks": 32
      },
      "expected_owner_roles": [
        "GC Procurement Manager (Lauren Pike)",
        "GC Sr PM (Priya Nair)"
      ],
      "expected_action": "Issue PO-0117 before Fri 10/9 at the quoted price and lead time",
      "confidence_expectation": "Confirmed (PO status, quote terms); Likely (float estimate past XER data date)",
      "new_or_worse": "NEW"
    },
    {
      "id": "F4",
      "title": "Owner contingency 92.4% used incl. pending at 46% complete; $95k left; CE-030 and CE-031 unpriced",
      "section": "cost_risks",
      "must_surface": true,
      "reference_rank": 3,
      "rank_expectation": "top 7",
      "min_severity": "high",
      "required_citations": [
        "procore:budget_snapshot:20261006",
        "procore:change_event:3515",
        "procore:change_event:3514"
      ],
      "min_citations_matched": 2,
      "key_facts": {
        "contingency_original_usd": 1250000,
        "approved_usd": 612000,
        "pending_usd": 543000,
        "remaining_usd": 95000,
        "pct_used": {
          "value": 0.924,
          "tolerance": 0.005
        },
        "pct_complete": 0.46
      },
      "expected_owner_roles": [
        "Owner Development Director (Dana Whitfield)",
        "VP Construction (Marcus Bell)"
      ],
      "expected_action": "Owner to set contingency strategy before approving more PCOs; require priced CE-030/CE-031 by a date",
      "confidence_expectation": "Confirmed",
      "new_or_worse": "WORSE (+$145k CE-031 today)"
    },
    {
      "id": "F5",
      "title": "Timberline pay app 6 bills Wing A framing at 62% vs ~35% schedule-earned (~$700k ahead of schedule-earned value); asks to cut retainage to 5%; lender Draw 9 visit Tue 10/13",
      "section": "cost_risks",
      "must_surface": true,
      "reference_rank": 4,
      "rank_expectation": "top 7",
      "min_severity": "high",
      "required_citations": [
        "procore:requisition:33056",
        "p6:activity:A1500",
        "msgraph_outlook:message:msg_E106",
        "msgraph_outlook:message:msg_E109"
      ],
      "min_citations_matched": 2,
      "key_facts": {
        "billed_pct": 0.62,
        "schedule_earned_pct": {
          "value": 0.35,
          "tolerance": 0.05
        },
        "overbilling_usd": {
          "value": 702000,
          "tolerance_pct": 15
        },
        "lender_visit": "2026-10-13"
      },
      "expected_owner_roles": [
        "GC Sr PM (Priya Nair)",
        "Owner (Dana Whitfield)"
      ],
      "expected_action": "Hold the Wing A framing line to verified in-place %; defer the retainage reduction; reconcile before the Draw 9 visit",
      "confidence_expectation": "Likely (schedule-earned % uses an aging XER and duration weighting)",
      "new_or_worse": "NEW"
    },
    {
      "id": "F6",
      "title": "Framing manpower on critical A1500 (TF 0) fell 14 -> 6 vs 16 planned; not weather; with F5 + E106 this is a subcontractor financial-distress pattern",
      "section": "schedule_risks",
      "must_surface": true,
      "reference_rank": 6,
      "rank_expectation": "top 7",
      "min_severity": "high",
      "required_citations": [
        "procore:manpower_log:80105",
        "procore:manpower_log:80104",
        "p6:activity:A1500",
        "procore:weather_log:80202",
        "msgraph_outlook:message:msg_E106",
        "procore:notes_log:80402"
      ],
      "min_citations_matched": 3,
      "key_facts": {
        "workers_day1": 14,
        "workers_day2": 6,
        "planned_crew": 16,
        "a1500_tf_wd": 0,
        "weather_delay": false
      },
      "expected_owner_roles": [
        "Superintendent (Tom Alvarez)",
        "GC Sr PM (Priya Nair)"
      ],
      "expected_action": "Get a written manpower recovery commitment from Timberline; line up a supplemental crew; review subcontract default/notice provisions",
      "confidence_expectation": "Confirmed (manpower); Likely (distress inference)",
      "new_or_worse": "NEW",
      "composite_with": [
        "F5"
      ]
    },
    {
      "id": "F7",
      "title": "Owner paver decision (OAC 14.03) 3 days late and carried forward from 2 prior OAC meetings (on 3 agendas); paver submittal not submitted (submit-by 10/3); zero ROS margin; scope not bought out",
      "section": "unresolved_decisions",
      "must_surface": true,
      "rank_expectation": "any",
      "min_severity": "medium",
      "required_citations": [
        "procore:meeting_item:991401",
        "procore:submittal:6501",
        "procore:rfi:9044",